{
  "canvas": { "width": 1280, "height": 720 },
  "road_width": 56,
  "core": { "x": 1120, "y": 360 },
  "spawns": [
    { "id": "sp_north", "x": 120, "y": 120 },
    { "id": "sp_south", "x": 120, "y": 600 }
  ],
  "paths": [
    {
      "id": "north",
      "spawn": "sp_north",
      "unlocked_at_wave": 1,
      "waypoints": [
        { "x": 120,  "y": 120 },
        { "x": 360,  "y": 160 },
        { "x": 620,  "y": 260 },
        { "x": 860,  "y": 360 },
        { "x": 1120, "y": 360 }
      ]
    },
    {
      "id": "south",
      "spawn": "sp_south",
      "unlocked_at_wave": 3,
      "waypoints": [
        { "x": 120,  "y": 600 },
        { "x": 380,  "y": 560 },
        { "x": 640,  "y": 460 },
        { "x": 880,  "y": 400 },
        { "x": 1120, "y": 360 }
      ]
    }
  ],
  "fork_nodes": [
    { "x": 880, "y": 380 }
  ],
  "build_slots": [
    { "x": 300,  "y": 300 },
    { "x": 520,  "y": 120 },
    { "x": 440,  "y": 400 },
    { "x": 700,  "y": 540 },
    { "x": 1000, "y": 240 },
    { "x": 960,  "y": 480 }
  ]
}
